workerid,proliferate.condition,speaker,error
158,condition=H&label=SH&respKeyExp=0&respKeyTest=0,I didn't notice anything odd about the person.,
85,condition=H&label=SH&respKeyExp=0&respKeyTest=0,How bored she seemed and the fact that she had a pen in her mouth sometimes.,
128,condition=H&label=SH&respKeyExp=0&respKeyTest=0,,
285,condition=H&label=SH&respKeyExp=0&respKeyTest=0,Nothing odd about the person.,
72,condition=H&label=SH&respKeyExp=0&respKeyTest=0,had a pen in her mouth sometimes ,
114,condition=H&label=SH&respKeyExp=0&respKeyTest=0,I didn't notice anything except that sometimes she had a pen in her mouth. ,
415,condition=H&label=SH&respKeyExp=0&respKeyTest=0,No.,
438,condition=H&label=SH&respKeyExp=0&respKeyTest=0,The speaker never looked at the camera and at times had a pen in her mouth or obscuring her mouth.,
123,condition=H&label=SH&respKeyExp=0&respKeyTest=0,"It feels like she made eye contact more on fake words. Oh and she got excited to say ""dinosaur"" made me chuckle. ",
258,condition=H&label=SH&respKeyExp=0&respKeyTest=0,Im not sure if the audio was synced with the mouth movement. It could be that the audio recording was separate from the video recording.,
270,condition=H&label=SH&respKeyExp=0&respKeyTest=0,"The audio didn't always seem to match her mouth movements, I don't know if it was lag or dubbing. She seemed oddly disinterested, but nothing too unusual. ",
139,condition=H&label=SH&respKeyExp=0&respKeyTest=0,She kept chewing on a pencil and speaking with it in her mouth.,
360,condition=H&label=SH&respKeyExp=0&respKeyTest=0,"Had an annoying habit of chewing on her pen, That was in the first half. In the second half I'm pretty sure that she wasn't saying either one of those words but they were dubbed over her.  And it was the same loop of her over and over again in the second half I don't even think it was her voice.",
409,condition=H&label=SH&respKeyExp=0&respKeyTest=0,Just her fidgeting with the pen,
87,condition=H&label=SH&respKeyExp=0&respKeyTest=0,"no, nothing odd other than talking with a pen in her mouth ",
348,condition=H&label=SH&respKeyExp=0&respKeyTest=0,,
122,condition=H&label=S&respKeyExp=0&respKeyTest=0,the pen in her mouth had to mean something,
113,condition=H&label=S&respKeyExp=0&respKeyTest=0,not particularly,
429,condition=H&label=S&respKeyExp=0&respKeyTest=0,"It was harder to understand when her pen was in her mouth, lack of eye contact, unable to read lips with lag.",
414,condition=H&label=S&respKeyExp=0&respKeyTest=0,"The girl in the video seemed disinterested and fiddled around with her pen a lot. Sometimes she had the pen in her mouth and I was unsure if it affected the way she was saying words. In the first portion, sometimes it sounded like she was saying words with an ""sh"" sound that should've been an ""s"" sound. I was unsure if I should mark those words as real words or not. I think that happened with ""peninsula""; it sounded like she said ""peninshula""",
65,condition=H&label=S&respKeyExp=0&respKeyTest=0,"The speaker appears to have a lisp. There were some words spoken that were actual words, but due to the lisp sounded as if they were not ""real"" words. Some examples are when the speaker says the words ""legacy"", ""pregnancy"", ""peninsula"", and more. The word ""legacy"", for instance, is phonetically leh-gah-see but the speaker pronounces it as leh-gah-she with the H sound. The lisp makes it difficult to further distinguish between ASI and ASHI pronunciation. ",
66,condition=H&label=S&respKeyExp=0&respKeyTest=0,they kept eating the pen it was annoying ,
284,condition=H&label=S&respKeyExp=0&respKeyTest=0,I didn't notice anything interesting.,
154,condition=H&label=S&respKeyExp=0&respKeyTest=0,Just that they were talking with the pen in their mouth sometimes.,
92,condition=H&label=S&respKeyExp=0&respKeyTest=0,,
394,condition=H&label=S&respKeyExp=0&respKeyTest=0,She kept chewing on a pencil and looking off into the distance ,
133,condition=H&label=S&respKeyExp=0&respKeyTest=0,She had a pen in her mouth about half of the time. Was that to see if we could still understand her? The 2nd half of the experiment was just the same exact asi sound over and over.,
316,condition=H&label=S&respKeyExp=0&respKeyTest=0,She had a pen in her mouth and seemed strange.,
436,condition=H&label=S&respKeyExp=0&respKeyTest=0,No.,
333,condition=H&label=S&respKeyExp=0&respKeyTest=0,I felt like breaking that pencil over her head so she would speak up.,
125,condition=H&label=S&respKeyExp=0&respKeyTest=0,She sometimes put an object in her mouth while speaking.,
320,condition=H&label=S&respKeyExp=0&respKeyTest=0,she chewed a pen,
336,condition=H&label=S&respKeyExp=0&respKeyTest=0,She put her pen in her mouth often which made her pronunciation not as clear.,
203,condition=M&label=S&respKeyExp=1&respKeyTest=1,Not really.  Maybe the pen she kept putting in her mouth.,
367,condition=M&label=S&respKeyExp=1&respKeyTest=1,Sometimes she said words with a pen in her mouth,
167,condition=M&label=S&respKeyExp=1&respKeyTest=1,She had a pen that she sometimes put in her mouth as she pronounced the words.,
314,condition=M&label=S&respKeyExp=1&respKeyTest=1,"The person was playing with a pen, sometimes they were chewing the pen while they were saying the words.",
195,condition=M&label=S&respKeyExp=1&respKeyTest=1,Pen in mouth sometimes,
174,condition=M&label=S&respKeyExp=1&respKeyTest=1,Nothing at all.,
412,condition=M&label=S&respKeyExp=1&respKeyTest=1,No,
251,condition=M&label=S&respKeyExp=1&respKeyTest=1,Yes. The speaker sometimes had a pen in her mouth and sometimes she didn't. I found that odd. Her mouth also didn't sync up perfectly with a lot of the words and sounds.,
317,condition=M&label=S&respKeyExp=1&respKeyTest=1,I don't think the person was saying asi and ashi in all the videos. It sounded dubbed in.,
165,condition=M&label=S&respKeyExp=1&respKeyTest=1,,
425,condition=M&label=S&respKeyExp=1&respKeyTest=1,She was using the pen to obscure her speech at times,
439,condition=M&label=S&respKeyExp=1&respKeyTest=1,Well I didn't think there was lag... I just thought her mouth movements didn't match up with the audio (and not because of timing),
318,condition=M&label=S&respKeyExp=1&respKeyTest=1,,
223,condition=M&label=S&respKeyExp=1&respKeyTest=1,no,
283,condition=M&label=S&respKeyExp=1&respKeyTest=1,she kept puting a pen in her mouth.,
246,condition=M&label=S&respKeyExp=1&respKeyTest=1,"I THOUGHT IT WAS WEIRD SHE HAD THE PEN IN HER MOUTH SO MUCH, SHE SEEMED TO BE MAKING WEIRD MOVEMENTS WITH HER LIPS. I FOUND HER ATTRACTIVE.",
